{"$schema":"https://json-schema.org/draft/2020-12/schema","$id":"publish.job.v1","type":"object","required":["contract_version","job_id","run_id","video_path","title","description","platforms","sender","hashtags","created_at"],"properties":{"contract_version":{"const":"publish.v1"},"job_id":{"type":"string"},"run_id":{"type":"string"},"video_path":{"type":"string"},"title":{"type":"string"},"description":{"type":"string"},"platforms":{"type":"array","items":{"enum":["youtube","facebook","instagram","tiktok"]},"minItems":1},"sender":{"enum":["media_spider","bullet_spider","sales_spider","closing_spider","user","other"]},"campaign_id":{"type":"string"},"source_brief_id":{"type":"string"},"product_sku":{"type":"string"},"utm_campaign":{"type":"string"},"hashtags":{"type":"array","items":{"type":"string"}},"thumbnail_path":{"type":"string"},"scheduled_at":{"type":"string"},"created_at":{"type":"string","format":"date-time"},"facebook_page_id":{"type":"string","pattern":"^$|^[0-9]+$","description":"Explicit Facebook Page destination; never inferred from account order."}},"additionalProperties":false}
