{"contract_version":"publish.v1","job_id":"job-test-001","run_id":"media-run-001","video_path":"outputs/sayf_72s.mp4","title":"سيف بن ذي يزن — ملحمة","description":"قصة سيف بن ذي يزن بصياغة سينمائية","platforms":["youtube","facebook","instagram","tiktok"],"sender":"media_spider","campaign_id":"nexa-stories-launch","source_brief_id":"brief-001","product_sku":"","utm_campaign":"nexa_launch","hashtags":["قصص","NexaStories","سينما"],"thumbnail_path":"","scheduled_at":"","created_at":"2026-09-22T21:00:00Z"}
